title,authors,year,citations,abstract,result_id,publication_info,pdf_links,url,total_results,search_time
A traditional scientific perspective on the integrated information theory of consciousness,J Mallatt,2021,24,"… After evaluating IIT, I will compare it to another theory of consciousness, … empirical evidence appears—and any unexpected evidence is then used to adjust the theory for further testing (…",FwW-REy-zNoJ,"J Mallatt - Entropy, 2021 - mdpi.com",[],https://www.mdpi.com/1099-4300/23/6/650,unknown,unknown
Integrated information theory: A consciousness-first approach to what exists,"G Tononi, M Boly",2025,4,"… , integration, and exclusion) permit the identification of … consciousness is subjective—it exists from the intrinsic perspective of an experiencing subject—the empirical evidence for IIT …",Nh7uCNOj0KAJ,"G Tononi, M Boly - arXiv preprint arXiv:2510.25998, 2025 - arxiv.org",[],https://arxiv.org/abs/2510.25998,unknown,unknown
Can the Integrated Information Theory Explain Consciousness from Consciousness Itself?,N Negro,2023,10,… -first” approach of the integrated information theory of consciousness (IIT) (Oizumi et al. 2014; … : finessing consciousness detection procedures and calibrating different measures of …,WQcKmziaIHUJ,"N Negro - Review of Philosophy and Psychology, 2023 - Springer",[],https://link.springer.com/article/10.1007/s13164-022-00653-x,unknown,unknown
The integrated information theory of consciousness: Unmasked and identified.,"B Merker, K Williford, D Rudrauf",2022,11,"… relation to key aspects of consciousness, and its co-variation with relevant empirical circumstances. Our analysis shows that IIT’s identification of consciousness with the causal efficacy …",9s0qKzN426cJ,"B Merker, K Williford, D Rudrauf - Behavioral & Brain …, 2022 - search.ebscohost.com",[],https://search.ebscohost.com/login.aspx?direct=true&profile=ehost&scope=site&authtype=crawler&jrnl=0140525X&AN=161758719&h=YEPbM%2F2quQPOu4rFLzu5C2CIaaHwzGRptIUq5L2sW6bYwZPCmOMd7uYje7QhrTytuI6jNnkY%2FnQruQie0nroVQ%3D%3D&crl=c,unknown,unknown
Integrated information theory,L Albantakis,2020,33,"… about the nature of consciousness, IIT instead starts from phe… empirically determined NCC. In the following, I will highlight … the PSC with IIT’s causal analysis thus requires testing all …",vnx3-dfIvn8J,"L Albantakis - Beyond neural correlates of consciousness, 2020 - api.taylorfrancis.com",[],https://api.taylorfrancis.com/content/chapters/edit/download?identifierName=doi&identifierValue=10.4324/9781315205267-6&type=chapterpdf,unknown,unknown
